<!--Sample XML file generated by XMLSpy v2022 rel. 2 (x64) (http://www.altova.com)-->
<Dataset xmlns:xsi="http://www.w3.org/2001/XMLSchema-instance" xsi:noNamespaceSchemaLocation="genome_DB.xsd">
	<GENOME Organism="human" Release_number="109" Release_date="2021-11-22" Name="Homo sapiens" Assembly="GRCh38.p14">
		<CHROMOSOME Chromosome_num="17">
			<GENE Description="TP53" Location_start="7666514" Location_end="7689397">
				<SEQUENCE Anomaly="NULL" Size="22883" Type="ADN" Sequence="CTCAAAAGTCTAGAGCCACCGTCCAGGGAGCAGGTAGCTGCTGGGCTCCGGGGACACTTTGCGTTCGGGCTGGGAGCGTGCTTTCCACGACGGTGACACGCTTCCCTGGATTGGGTAAGCTCCTGACTGAACTTGATGAGTCCTCTCTGAGTCACGGGCTCTCGGCTCCGTGTATTTTCAGCTCGGGAAAATCGCTGGGGCTGGGGGTGGGGCAGTGGGGACTTAGCGAGTTTGGGGGTGAGTGGGATGGAAGCTTGGCTAGAGGGATCATCATAGGAGTTGCATTGTTGGGAGACCTGGGTGTAGATGATGGGGATGTTAGGACCATCCGAACTCAAAGTTGAACGCCTAGGCAGAGGAGTGGAGCTTTGGGGAACCTTGAGCCGGCCTAAAGCGTACTTCTTTGCACATCCACCCGGTGCTGGGCGTAGGGAATCCCTGAAATAAAAGATGCACAAAGCATTGAGGTCTGAGACTTTTGGATCTCGAAACATTGAGAACTCATAGCTGTATATTTTAGAGCCCATGGCATCCTAGTGAAAACTGGGGCTCCATTCCGAAATGATCATTTGGGGGTGATCCGGGGAGCCCAAGCTGCTAAGGTCCCACAACTTCCGGACCTTTGTCCTTCCTGGAGCGATCTTTCCAGGCAGCCCCCGGCTCCGCTAGATGGAGAAAATCCAATTGAAGGCTGTCAGTCGTGGAAGTGAGAAGTGCTAAACCAGGGGTTTGCCCGCCAGGCCGAGGAGGACCGTCGCAATCTGAGAGGCCCGGCAGCCCTGTTATTGTTTGGCTCCACATTTACATTTCTGCCTCTTGCAGCAGCATTTCCGGTTTCTTTTTGCCGGAGCAGCTCACTATTCACCCGATGAGAGGGGAGGAGAGAGAGAGAAAATGTCCTTTAGGCCGGTTCCTCTTACTTGGCAGAGGGAGGCTGCTATTCTCCGCCTGCATTTCTTTTTCTGGATTACTTAGTTATGGCCTTTGCAAAGGCAGGGGTATTTGTTTTGATGCAAACCTCAATCCCTCCCCTTCTTTGAATGGTGTGCCCCACCCCGCGGGTCGCCTGCAACCTAGGCGGACGCTACCATGGCGTGAGACAGGGAGGGAAAGAAGTGTGCAGAAGGCAAGCCCGGAGGTATTTTCAAGAATGAGTATATCTCATCTTCCCGGAGGAAAAAAAAAAAGAATGGGTACGTCTGAGAATCAAATTTTGAAAGAGTGCAATGATGGGTCGTTTGATAATTTGTCGGAAAAACAATCTACCTGTTATCTAGCTTTGGGCTAGGCCATTCCAGTTCCAGACGCAGGCTGAACGTCGTGAAGCGGAAGGGGCGGGCCCGCAGGCGTCCGTGTGGTCCTCCGTGCAGCCCTCCGGCCCGAGCCGGTTCTTCCTGGTAGGAGGCGGAACTCGAATTCATTTCTCCCGCTGCCCCATCTCTTAGCTCGCGGTTGTTTCATTCCGCAGTTTCTTCCCATGCACCTGCCGCGTACCGGCCACTTTGTGCCGTACTTACGTCATCTTTTTCCTAAATCGAGGTGGCATTTACACACAGCGCCAGTGCACACAGCAAGTGCACAGGAAGATGAGTTTTGGCCCCTAACCGCTCCGTGATGCCTACCAAGTCACAGACCCTTTTCATCGTCCCAGAAACGTTTCATCACGTCTCTTCCCAGTCGATTCCCGACCCCACCTTTATTTTGATCTCCATAACCATTTTGCCTGTTGGAGAACTTCATATAGAATGGAATCAGGCTGGGCGCTGTGGCTCACGCCTGCACTTTGGGAGGCCGAGGCGGGCGGATTACTTGAGGATAGGAGTTCCAGACCAGCGTGGCCAACGTGGTGAATCCCCGTCTCTACTAAAAAATACAAAAATTAGCTGGGCGTGGTGGGTGCCTGTAATCCCAGCTATTCGGGAGGGTGAGGCAGGAGAATCGCTTGAACCCGGGAGGCAGAGGTTGCAGTGAGCCAAGATCGTGCCACTACACTCCAGCCTGGGCGACAAGAACGAAACTCCGTCTCAAAAAAAAGGGGGGAATCATACATTATGTGCTCATTTTTGTCGGGCTTCTGTCCTTCAATGTACTGTCTGACATTCGTTCATGTTGTATATATCAGTATTTTGCTCCTTTTCATTTAGTATAGTCCATCGATTGTATATCCGTCCTTTTGATGGCCTTTTGAGTTGTTTCCCATTTGCGGTTATGAAATAAAGCTGCTATAAACATTCTTGTACAATTCTTTTTGTGATCATATGTTTTCGTGTTTCTTGGAGAAATACTTAGGAGGGGAATTGCGAGTTTGGAAGTAAAAAGTAGCTGTATTTTGAACTTTTTCAGAAGCTCTGAGTTTTCCAGAGCGGTTGTACCATTTTACACTCCAACTAGCAAGGTATGGGAGTTATTATGGTTGTGCCACAGCCTTCCGGACATTAGGTATTGTCAGTCTTTCTAATGTGGTATATCCTTGTGGTTGTAATTTACAGTTCTCTATTGACTAAGGATGTTCAGCATTTTTTCATGTGCCTATTGGCCATTCGTATTTTGTTTGTAAAGTAGCTCTTCGAGTCTTTTACCTGTTATTTTGGTTTTTTGTTTGTTTTTATTGTTCAGTTGTGGGACTGCTTTATACATTCTGGATACAAGTCCTTTATCAGATCCATGTGTCGTGAATGTTTTCTTCTGATCTGTTGCTTGCCTATTTGTTTGCTTTACAGAGTTTACAGTATCTTAAGAGGAGTGGATTTATCTTTTTTATGTTCAGTATTTGCCTTGTCCTGTTTAGGACATCTTTTTTTTTTTTTTTAACCCCAGGGTCATGAAGATATTATCTTACATTTTCTTTTAGGACCTTTATGGTTGTAAGTTTTACAGTAAGGTCCTTGAGCCATTAATTAATTCTTAAAATTAATTGTTTATGGTGTGAGGTGTAGGAGTCAGTCTCTGGTATCTTTCCTGTATGGAAATCCAGTTATTCTGTCTCCACTTGTTGAAATAGGCTTCCTTTCTCTACTGAATGCTTTTAATTTTAATTATTTTACAGTTGGAGTATAGGGCTACCATTTTAGTGCTATTTTCTTTTTTTCTTTGTTAATTTTTGAGACAGGGACTCACACTGTTGCCCAGGCTAGAGTACAATGGCACAATCAAGGCTTACTGCAGCCTCGAACCCCTGGGCTCAAGCAGTCCTCTAGCAGCCTCACGAGTAGCTGGGATTACTCCACCACACCCAGCTAACTATTTTATTTTTTTGTATTGACAGGATCTCACTATGTTGCCCAGGCTGGTCTCAAACTGCTGGCCTCAAGCTTTCATCCCATCTCGGCCTCCCAAAGTGCTGGGATTACAGGTGTGAGCCACCATGCCTGACCTCTTAGTGCTATTTTCTATTTATCTCCTCTGTTCTCTGCTCTCTTTAAACGTTGGAGGAAGAAACAGTACCCATCTTACACAAACTCTTCAGAAAACAGAGGAACAGACTGGGCGCGGTGGCTCATACCTGTAATCTCAGCACTTTGGTACGCTGAGGCAGGGGATCATTTGAGGTCGGGAGTTCGAGACCAGCCTGGCCAACACGGCGAAACCCCATCTCTACTAAAAATACAAAAAGTAGCTAGGCGTGGTGACACATACCTGTAATGCCAGTTACTCAGGAGGCTGAGGCACAAGAATCCCTTGAACCTGGGAAGCGGAGGTTGCAGTGAGCCGAGATTGCGCCACTGCACTCCAGCCTGGGCAACAGAGTGAGACCCTGTCTCAGAAAAAAAAAGAAAGAAAGAAAAAATAGAGGAATATTTCCCAACTTGTTTTCGAAGCCAGCATAATCCTGGTACCAAAACCAAACAAGGACATTATAAGAAAAGAAAATATAGACCAATATTCCTGTTAGCATAGACATGCAACAGCTAACCAATTTTAGCAAACCAAACCTGGTAATATAGAAAAAAGGATAAATAGGCCAGTCGCGGTGGCTCACGCCTGTAATCCCAGCACTTTGGGAGGCTGAGGCAGGCAGATCACTTGAGGTCAGGAGTTTGAGACCAGCCTGACCAACATGGTGAAACCCCGTTTCTAATAAAAATACAAAAATCAGGCTGGGCACGGTGGCTCACGCCTGTAATCCCAGCACTTTGGGAGGCCGAGGTGGGCAGATCACGAGGTCAGGAGTTCAAGACCAGCCTGACCAATGTGGTGAAACGCCATCTCTACTAAAAATACAAAAATCAGCCGGTGTGGTGGCACCTGCCTGTAATCCCAGCTACTCAGGAGGCTGAGGCAGAATTGCTTGAACCCGGGAGGCAGAGGTTGCAGTGAGCCAAGATCGTGCCACTGCACTCCAGCCTGGGCGACAGAGCAAGACTTCATCTCAAAAAAAAAAAAAAATTAGCTGGGCATGGTGGTGGGCACCTGAAATCCCAGCTACTCGGGAGTCTGAGGCAGGAGAATCGCTTGAACCCAGGAGGCAGAAGTTGCACTGAGCTGGGATCACACCATTGCACTCCAGCCTGGGCAACAGAGTGAGACTCCATCTCAAAAAAAGAAAAAGAAAAAGGATAAATACATTCTAACCAAATAATGTTTATCTCATGATTGTAGCTGATTCAACATTCAAAAATTGGCCTGGTGCAGTAGCTCAGGCCTGTAATCCCAACATTTTAGGAGGCTGAGGCAGGAAGATCTCTTGAGCCCAGGATTTCAAGACCAGCCTGGGCAACATAGTCAGACTGGTCTTTACTGGGGGGAAAAAAATCAGTCTGTGTAATTCACCACATTAACAAAGGGAAACATAAAAACCCTATGATCATTTCAACAGATGTAGCAAAAGCAGTTAATGATATTCAACACATATGCATGATTACAAACCAACCAACCTCCTAGCAAACTAGGGAAAGGAAACTTAACCTAGTTTGATAACAGGGCGTCCACAGTCGGAGTTCCACTAGCAGCATACATAATGGTAGAAAACTCAGTGCTGCCGGGCGCGGTGGCTCACGCCTGTAATGCCAGCACTTTGGGAGGCCTAGGCGGGCGGATCACGAGGTCAGGAGATCGAGACTGTCCTGACTAGCATGCTGAAACCCCGTCTCTACTAAAAATACAAAAACAAAAAATTAGCCGGGCATGGTGGCGGGCGCCTATAGTCCCAGCTACTCGGGAGGCTGAGGCGAGAGAATGGCGTGAACCCGGGAGGCGGAGCTTGCAGAGCCTAGATCGTGCCACTGCACTCCAGCCTGGGTGACAGAGTGAGACTTCGTCTCAAAAAAAAAAAAAAAAAAAAAAGAAAAGAAAACTCAACGCTTTTTCCTCTAAGATCAGGAACTAGAAAAGGATTTGACTCTCACAACGTTGATACCATACTGGAGGTTTTAACCAGGCAAGAAAAAGAAATAATGAGGGCCGGGTGCGGTGGCTCAGGCCTGTAATCCCAGCACTTTGGGAAGCCGAGACGGGTGGATCACGAGGTCAGGAGATCGAGACCATCCTGGCTAACACGGTGAAACCCTGTCTCTACTAAATATACAAAAAATTAGCCGGGCGTAGTGGCGGGCGCCTGTAGTCCCAGCTACTCGGGAGGCTGAGGCAGGAGAATGGCGTGAACTCAGGGGGCGGAGCTTGCAGTGAGCTGAGATCGAGCCACTGCACTCCAGCCTGGGCGACAGAGCAAGACTGTGTCTCAAAAAAAAAAAAAGAAAAAGAAATAATGATTAGTGGCCCGATGTCTCACGCCTATAATCCCAGCACTTTGGGAGGCCGAGGTGGGCAGATCACCTGAGGTCTGGAGTTGGAGACCAGCCTGACAAAGATGGTGAAACCTCGTCTCTATTAAAATATTAAAAAAATAGCCAGGCGTTGGCCGGGTACAGTGGCTCATGCCTGTAATCCCAGCACTTTGGGAGGCCGAGGTGGGTGGATCACCTGAGGTCAGGAGTTCAACACCAGCCTGGCCAACATGGTGAAACCCCATCTCTACTAAAAATACAAAAATTAGCCGGGCGTAGTGGCGGGCGCCTGTAATCCCAGCTACTTGGGAGGCTTAGGCAGGAGAATCGCTTGAACCTGGGAGGCGGAGGTTGTAGTGAGCCGAGATTGCACCATTGCACTCCAGCCTGGGTGACAAAAGCAAAAACTCCGTCTCAAAAAAAAAAGAATTAGCCAGGGGTAGTGGTGAACGCCTGTAGTCCCAGCTACTCAGGAGGCAGAGGCAGGAGAATCACTTGAACCCAGGAGGCAGAGGTTGCAGTGAGCCGAGATTGTCCCATTGCACTCCAGCCTAGGCGACAAGAGCAAAATTCCATGTCAAAAAAAAAAAAAAAAAAGGAAAGAAAAAAAATAACGATTAGAAAGGAAGAAATAAAACACATTCACAGCCAGTATGATTCTATACATACATGTCCTAATGGGGCCAGGCGTGGTGGCTCATGCCTGTAATCCTAGCACTTTTAGGAGGCTGAGGCAGGTGGCTTCCCTGGGACCAGCCTGGCCAACATGGTGAAACCCCAACTCTAATAAAAATACAAAAAATCAGCCAGGCGTGGTGACGGGCACCTCTAATCCCAGCTACTCAGGAGGCTGAGGCAGGAGAATTGCTTGGACCTGGGAGGCAGAGGTTGCAGTGAGCCGAGATCGCGCTATTGCACTCCAGCCTGGGCAACAAGAGTGAAACTCCGGCAGGGTGTGGTGGCTTACGCCTGTAATCCCAGCACTTCGGGAGGCTGAGGCAGGCCGATCACCTGAGGTCAGGAGTTTGAGACCAACCTAACATGGTGAAACCCCGTCTCTACTAAAAATACAAGAATTAGCTGGGTGTAGTGGTGGGCGCCTGTAATCCCAGCTACTTGGGAGGCTGAGACAGAAGAATTGCTTGAACCCAGGAGGTGGAGGTTGCAGTGAGCTGAGATCATGCCATTGCACACCACGCCGGGCAACAGAGCGAGATTCCGTCTCAAAAAAAAAAAAAAAGAGTGAAACTCTATCTCAAAAAAAAAAAAAAGTCCTAATGGAAAATCCATAAAAAGCTACCAAAACTAATAAATAAATATAGCAGGGTTGCAGGTTACAGGGCAATATAGTTATCCCTCTATCTGTAGGGGCTTGGTTCTGGGACTCCTCACACACCAAACCCACAGATGTCTAAGTCCCATATATAAGACGGTATAGTATTTGGATTTAACCTACACATATCCTCCCATATAGTTTAAATTATCTCTAGATTACTTACATTACCCCCATACAATGAAAATGCTAATGTACATGCAAGTATGTATGTAAGTACTTGTACTATATTGTTTAGGGAATCACTGGACATATAGGCCTTCAAGACTGATACCAGCAGCCACTGTTAAGATTCTGGTCAGGCCTGCCCCTGTTTGGGGTCTCAGTTGATCTCATTGCCTTCCCACCCAGCCAAGGGCACCTGCATTTCTCTTGGCTCCCTGGCCATTTGGAAGGCCTAGTTCAGCCTGGCACATTTGTATCCTGGCCCACTGATGCTGGTACCCCTGGGAAGGTCCTGCTCTGAAAAACACGGAGATTTTAGTTGCTACTGAAGATTTGAGAGATAAAGACAGGGAGACCTGTCTGTAGACCTGTGTCCCTCCAAGTGGGATTGAGACTTTGGGCCCCCCATTTCAGGACAGCACCTCCTGGCCTGTTGACTGAATAGATCCCTGAAGGAGGTGTACTTGCATTAATGGAGTGGGGGTGGGAGCAGTACCACAGATCCGCACTAACAATCACACAGTTCTCTCTAGAATAATAATATAGAACAAGTGAAATAGAACAATTGCAGAAAGAGCTAACCTTTGTTGAGCTCTTACTGTGTGCCCAGCACTTTCCTCAACTCTACATTTCCCATAATACACAGAGTACTAGGTAGGCCAGGCTTGGTGGCTCACGCCTGTAATCCCAGCACTTTAGGAGGCCAAGGGGGGTGGATCACCTGAGGTCGGGAGTTCAAGACCAGCCTGACCAACATGGTGAAACCCCGTCTCTACTAGAAGTACAAAATTAGCCAGGTGTGGTGGCACATGCTTGTAGTCCTAGCTACTCAGCAGGCTGAGGCAGGAGAATCATTTGAATCCGGGAGGAGGTTGCAGTAAGCGGAGATAGTGCCACTGTACTCCAGCCTGGGCAATAAGAGCTGAGACTCCGTCTCAAAATAAAATAAAATAAAATAAAATAAAATAAAATAAAATAAAAAAAGAAAAGAGCCTGCCATTAAAGGAGCTGTTTGGTAGGGGATGTTTTGTCAGTGCAAACAACAGAAAAGTGGGCTGGGCACAGTGGTTCATGCCTGTAATCCCAGCACTTTGGGAGGCCAAGGCGGGCGGATCACCTGAAGTTGGGAGTTCAAGACCAGCCTGACCAATATGGAGAAACCCCGTCTCTACTAAAAATACAAAATTAGCCGGGCGCAGTGGCGCATGCCTGTAATCCCAGCTACTCGGGAGGCTGAGGCAGGAGAATCGCTTGAACCTGGGAGGCAGAGGTTGCGGTGAGCCGAGATCGCACCATTGCACTCCAGCCTGGACGAGAGCAAAACTCTGTCTCAAAAAAAAAAAAAAACAGAAAAGTGTAACAAACACTTACAGTAGGCATGTTTCTTAGCAAATCTGATGACAAATTTGGCATAAAGAAAGAGAGCATCCCTGAAAAAAAAAAAAAGAAAAAGAAAGAGAGCATCCTGCCTGGGCAACATAGTGAAACCCTGCCTCTACAAAAAAACTCAAAAATTGGCCGGGTGCAGTGGCTCACACCTGTAATCCCAGCACTTTGGGAGTCGGAGGCGGGAGGATCACCTGAGGTCAGGAGTTCGAAACCAGCCTGGCCAACATGGCAAAACCCCATCTCTACTAAAAATACAAAAAATTAATCAGGCGCATTGGTGGGCGCCTGTAATCCCAGCTACTCAGGAAGTTGAGGCAAGAGGATCGCTTGAATCTGGGAGGTGGAGGTTACAGTGAGTCGAGATCACACCACTGCACTCTAGCCTGGGTGACAGGGCGAGACTCCGTCTCCAAAAAAAAAAAGAAAAAGAAAAAGACTAAAAAATTAGCCAGGCAGGCCTCTGTGGTCCCAGCTACTTGGGAGGCTGAGGCAGGAGAATCACTGAGCCCAGGAGTCCGAGGCTGTAGTGAGCCATGATTGCACCACTGTACCCTAGCTTGGGCAACAAAGCAAGACCCTGCCTCAAAAGAAAAAAGAAAGAAAGAAAGAACATGGCGGGCCAGGCACAGTGGCTCACACCTGTAATCCCAGCGCTTTGAGAGGCCGAGGCAGGTGGATCACAAGGTCAGGAGTTCCACACCAGCCTGGCCAACATGGTGAAACCCTGTCTCTACTAAAAATACAAAAAATCAGCCAGGCATGGTGGCAGGGGCCTGTAATCCCAGCTACTCGGGAGGCTGAGGCAGGAGAATTGCTTGAAACCAGAAGGCAGAGGTTGCAGTGAGCCTAGACTGCACCACTGCACTCCAGCCTGGGCGAAAAGAGCCAAACTCCATCTCAAAA